{
  "contract_version": 1,
  "tool": {
    "name": "dbcan-workflow",
    "version": "0.3.0"
  },
  "command": "verify-db",
  "run_id": null,
  "outcome": {
    "kind": "negative",
    "code": "DB_MISMATCH",
    "summary": "The cache does not match the expected manifest."
  },
  "exit": {
    "code": 4,
    "policy": "strict"
  },
  "evidence": {
    "structure": "not_assessed",
    "attestation": "not_applicable"
  },
  "result": {
    "match": false,
    "snapshot": "db_v5-2-9_5-5-2026",
    "expected_file_count": 646,
    "observed_file_count": 0,
    "missing_count": 646,
    "unexpected_count": 0,
    "mismatched_count": 0,
    "listed": {
      "missing": [
        "./CAZy.dmnd",
        "./PUL.dmnd"
      ],
      "unexpected": [],
      "mismatched": []
    },
    "listed_truncated": true,
    "max_listed": 20
  },
  "refusal": null,
  "findings": [],
  "warnings": [],
  "artifacts": [
    {
      "role": "observed_manifest",
      "path": "<observed-manifest>",
      "sha256": null,
      "written": true
    }
  ],
  "claims": {
    "may_say": [],
    "may_not_say": [
      {
        "id": "CL-N2",
        "text": "The database was verified.",
        "source": "references/provenance.md"
      }
    ]
  },
  "diagnostics": [],
  "diagnostics_total": 0,
  "diagnostics_truncated": false,
  "trust": {
    "untrusted_paths": [
      "/diagnostics",
      "/refusal/details",
      "/artifacts/*/path",
      "/findings/*/location",
      "/warnings/*/location",
      "/result",
      "/failure/diagnostic",
      "/failure/log_tail",
      "/failure/log_path",
      "/failures",
      "/sample",
      "/samples",
      "/input_faa",
      "/input_gff",
      "/results_dir",
      "/metadata_dir",
      "/stages/*/argv",
      "/stages/*/log_file",
      "/stages/*/reason",
      "/details",
      "/validation",
      "/scientific_summary",
      "/sample_summaries",
      "/preflight"
    ]
  }
}
